Sheet: Template
A1: Template (Deluxe)
B3: Amount | C3: Unit | E3: kcal | F3: Fat | G3: Carbs | H3: Sugar | I3: Protein | J3: Salt
A4: Nutritional values per 100g/ml | B4: 100 | C4: g | E4: of:=[.E6]/[.$B6]*[.$B4] -> 107.3 | F4: of:=[.F6]/[.$B6]*[.$B4] -> 0 | G4: of:=[.G6]/[.$B6]*[.$B4] -> 54.7 | H4: of:=[.H6]/[.$B6]*[.$B4] -> 3.7 | I4: of:=[.I6]/[.$B6]*[.$B4] -> 0.1 | J4: of:=[.J6]/[.$B6]*[.$B4] -> 1.7
A5: Nutritional values per ½ Deluxe Tub | B5: 360 | C5: g | E5: of:=[.E6]/[.$B6]*[.$B5] -> 386.28 | F5: of:=[.F6]/[.$B6]*[.$B5] -> 0 | G5: of:=[.G6]/[.$B6]*[.$B5] -> 196.92 | H5: of:=[.H6]/[.$B6]*[.$B5] -> 13.32 | I5: of:=[.I6]/[.$B6]*[.$B5] -> 0.36 | J5: of:=[.J6]/[.$B6]*[.$B5] -> 6.12
A6: Nutritional values total | B6: of:=SUMIFS([.B21:.B964];[.C21:.C964];"=(g|ml)";[.D21:.D964];"<>4") -> 0.01 | C6: g | E6: of:=SUMPRODUCT([.$B21:.$B999];[.E21:.E999])/100 -> 0.01073 | F6: of:=SUMPRODUCT([.$B21:.$B999];[.F21:.F999])/100 -> 0 | G6: of:=SUMPRODUCT([.$B21:.$B999];[.G21:.G999])/100 -> 0.00547 | H6: of:=SUMPRODUCT([.$B21:.$B999];[.H21:.H999])/100 -> 0.00037 | I6: of:=SUMPRODUCT([.$B21:.$B999];[.I21:.I999])/100 -> 0.00001 | J6: of:=SUMPRODUCT([.$B21:.$B999];[.J21:.J999])/100 -> 0.00017
A8: FPDF / PAC (target 20..30) | B8: of:=SUMPRODUCT([.$B21:.$B999];[.$K21:.$K999])/[.$B$6]*100+5.9*[.$J$4] -> 142.03
A9: Protein / Energy Ratio (ok=12%; hi=20%) | B9: of:=[.I4]*4/[.E4] -> 0.00372786579683131
A11: Comment (Ctrl-Return for line breaks)
A16: 30g Ice Cream Stabilizer (ICSv2) is | B16: 14.3g erythritol, 1.43g Tylose powder (CMC, E466), 0.5g tara gum (E417), 0.15g xanthan (E415), 14.3g inulin, 0.5g salt.
A18: The [brand names] used are in brackets.
A20: Ingredients | B20: Amount | C20: Unit | D20: # | E20: kcal | F20: Fat | G20: Carbs | H20: Sugar | I20: Protein | J20: Salt | K20: FPDF | L20: Comment
A21: Allulose | B21: 0 | C21: g | D21: 2 | E21: 40 | G21: 80 | K21: 1.9 | L21: Sweetness = 70%; GI ~= 0
A22: Almond milk (unsweetened) | B22: 0 | C22: ml | D22: 1 | E22: 29 | F22: 2.5 | G22: 0.5 | H22: 0 | I22: 1 | J22: 0.1
A23: Apricots (canned) [Del Monte] | B23: 0 | C23: g | D23: 1 | E23: 60 | F23: 0 | G23: 14 | H23: 12 | I23: 0.4 | J23: 0.07 | K23: of:=[.H23]/100 -> 0.12
A24: Bananas (peeled) | B24: 0 | C24: g | D24: 1 | E24: 108 | F24: 0.6 | G24: 21.5 | H24: 16 | I24: 1.22 | J24: 0.03 | K24: of:=[.H24]/100 -> 0.16
A25: Black sesame seeds, roasted [Emma Basic] | B25: 0 | C25: g | D25: 4 | E25: 597 | F25: 51 | G25: 2.5 | H25: 1.1 | I25: 25 | J25: 0 | L25: Mix-in for a full tub (2 servings)
A26: Blueberries (canned) [REWE] | B26: 0 | C26: g | D26: 1 | E26: 82 | F26: 0.5 | G26: 16.2 | H26: 16.2 | I26: 0.5 | J26: 0 | K26: of:=[.H26]/100 -> 0.162
A27: Brandy “Williams Birne” 40 vol% | B27: 0 | C27: g | D27: 1 | E27: 280 | K27: of:=7.4*0.4 -> 2.96
A28: Butter | B28: 0 | C28: g | D28: 1 | E28: 731 | F28: 82 | G28: 0.8 | H28: 0.8 | I28: 0.6 | J28: 0.03
A29: Cherries | B29: 0 | C29: g | D29: 1 | E29: 61 | F29: 0.1 | G29: 13.6 | H29: 9.6 | I29: 0.9 | J29: 0 | K29: of:=[.H29]/100 -> 0.096
A30: Chia seeds [Mr. Brown] | B30: 0 | C30: g | D30: 2 | E30: 444 | F30: 31.1 | G30: 4.5 | H30: 0.8 | I30: 21.2 | J30: 0.03
A31: Cocoa Powder 21% [Bensdorp Premium] | B31: 0 | C31: g | D31: 0 | E31: 366 | F31: 21 | G31: 8.9 | H31: 0.6 | I31: 20 | J31: 0.1
A32: Cocoa Powder 21% [cebe] | B32: 0 | C32: g | D32: 0 | E32: 358 | F32: 20.7 | G32: 8.8 | H32: 0.5 | I32: 19.8 | J32: 0.08
A33: Coconut milk 22% [REWE Bio] | B33: 0 | C33: ml | D33: 1 | E33: 222 | F33: 22 | G33: 4 | H33: 4 | I33: 2 | J33: 0.04 | K33: of:=[.H33]/100 -> 0.04
A34: Cottage Cheese 4% [REWE Bio] | B34: 0 | C34: g | D34: 1 | E34: 91 | F34: 4 | G34: 1 | H34: 1 | I34: 12.7 | J34: 0.69 | K34: of:=[.H34]/100 -> 0.01
A35: Cream 32% [REWE Beste Wahl] | B35: 0 | C35: ml | D35: 3 | E35: 311 | F35: 32 | G35: 3.2 | H35: 3.2 | I35: 2.5 | J35: 0.13 | K35: of:=[.H35]/100 -> 0.032
A36: Cream Cheese 23% [Exquisa] | B36: 0 | C36: g | D36: 1 | E36: 238 | F36: 22.5 | G36: 3 | H36: 3 | I36: 5.5 | J36: 0.7 | K36: of:=[.H36]/100 -> 0.03
A37: Dark chocolate 85% [Moser-Roth] | B37: 0 | C37: g | D37: 4 | E37: 604 | F37: 50 | G37: 20 | H37: 14 | I37: 11 | J37: 0.24 | L37: Portion = 25g
A38: Dragon Fruit (freeze dried) [Zingy Zoo] | B38: 0 | C38: g | D38: 2 | E38: 393 | F38: 5.3 | G38: 78.6 | H38: 53.6 | I38: 7.1 | J38: 0 | K38: of:=[.H38]/100 -> 0.536 | L38: for color
A39: Egg Cream Punch 9 vol% [Katlenburger] | B39: 0 | C39: ml | D39: 1 | E39: 84 | K39: of:=[.H39]/100+0.09*0.789*7.4 -> 0.525474 | L39: 1 bottle = 750ml
A40: Egg Liqueur 15 vol% [Bols Advocaat] | B40: 0 | C40: ml | D40: 1 | E40: 85 | F40: 6.8 | G40: 27 | H40: 27 | I40: 1 | J40: 0 | K40: of:=[.H40]/100+0.15*0.789*7.4 -> 1.14579 | L40: 1 bottle = 700ml
A41: Erythritol (E968) | B41: 0 | C41: g | D41: 2 | E41: 0 | F41: 0 | G41: 100 | H41: 0 | I41: 0 | J41: 0 | K41: 2.8 | L41: Sweetness = 75%
A42: Flavor drops Caramel [IronMaxx] | B42: 0 | C42: drops | D42: 1
A43: Flavor drops Peach / Maracuja [IronMaxx] | B43: 0 | C43: drops | D43: 1
A44: Flavor drops Vanilla [IronMaxx] | B44: 0 | C44: drops | D44: 1
A45: Full Fat Milkpowder [Mr. Brown] | B45: 0 | C45: g | D45: 2 | E45: 482 | F45: 26 | G45: 35 | H45: 35 | I45: 25 | J45: 0.94 | K45: of:=[.H45]/100 -> 0.35
A46: Gelatin powder | B46: 0 | C46: g | D46: 2 | E46: 357 | I46: 84.4 | J46: 0.04
A47: Glycerin (E422, VG) [hd-line] | B47: 0 | C47: g | D47: 1 | E47: 400 | G47: 99 | K47: 3.7 | L47: Sweetness = 60%; GI = 5; Density = 1.26 g/ml
A48: Glycerol Monostearate (E471) [Bulk] | B48: 0 | C48: g | D48: 2 | E48: 415
A49: Goji berries dried [Happy Belly] | B49: 0 | C49: g | D49: 4 | E49: 395 | F49: 0.4 | G49: 77.1 | H49: 45.6 | I49: 14.3 | J49: 0.75 | L49: Mix-in for a full tub (2 servings)
A50: Greek Yogurt 9% [Lyttos] | B50: 0 | C50: g | D50: 1 | E50: 113 | F50: 9.2 | G50: 3.8 | H50: 3.8 | I50: 3.2 | J50: 0.13 | K50: of:=[.H50]/100 -> 0.038
A51: Greek Yogurt Apricot [Lyttos / Aldi] | B51: 0 | C51: g | D51: 1 | E51: 131 | F51: 8 | G51: 12.2 | H51: 11.5 | I51: 2.6 | J51: 0.09 | K51: of:=[.H51]/100 -> 0.115
A52: ICS [Erythritol / CMC / Tara / XG] | B52: 0 | C52: g | D52: 2 | E52: 23 | G52: 93.6 | I52: 0.1 | J52: 3.3 | K52: 2.33
A53: ICSv2 [Erythritol / CMC / Tara / XG / Inulin] | B53: 0.01 | C53: g | D53: 2 | E53: 107.3 | F53: 0 | G53: 54.7 | H53: 3.7 | I53: 0.1 | J53: 1.7 | K53: 1.32 | L53: http://bit.ly/4frc4Vj
A54: Inulin [Vit4ever] | B54: 0 | C54: g | D54: 2 | E54: 210 | G54: 8 | H54: 8 | J54: 0.2 | K54: 0.09 | L54: Sweetness = 8%; GI ~= 0
A55: Inulin HP [Saporepuro] | B55: 0 | C55: g | D55: 2 | E55: 194 | G55: 0.5 | H55: 0.5 | K55: 0.1
A56: Irish Cream 17 vol% [Baileys] | B56: 0 | C56: ml | D56: 1 | E56: 314 | F56: 13.6 | G56: 21.7 | H56: 18 | I56: 2.8 | J56: 0 | K56: of:=[.H56]/100+0.17*0.789*7.4 -> 1.172562 | L56: 1 bottle = 700ml
A57: Mandarins in juice [REWE] | B57: 0 | C57: g | D57: 1 | E57: 48 | F57: 0 | G57: 11 | H57: 9 | I57: 0.6 | J57: 0.02 | K57: of:=[.H57]/100 -> 0.09
A58: Mango | B58: 0 | C58: g | D58: 1 | E58: 62 | F58: 0.5 | G58: 13 | H58: 13 | I58: 0.6 | J58: 0 | K58: of:=[.H58]/100 -> 0.13
A59: Molasses [Grafschafter Goldsaft] | B59: 0 | C59: g | D59: 1 | E59: 306 | F59: 0.5 | G59: 70 | H59: 66 | I59: 2.3 | J59: 0.03 | K59: 0.66 | L59: Sweetness = 66%
A60: Monk fruit sweetener | B60: 0 | C60: g | D60: 2 | K60: 0.1 | L60: FPDF is guesstimated
A61: PB powder [Vilgain] | B61: 0 | C61: g | D61: 2 | E61: 387 | F61: 14 | G61: 17 | H61: 9 | I61: 48 | J61: 0.02 | K61: of:=[.H61]/100 -> 0.09
A62: Philadelphia Milka | B62: 0 | C62: g | D62: 1 | E62: 286 | F62: 13 | G62: 34 | H62: 33 | I62: 6.4 | J62: 0.48 | K62: of:=[.H62]/100 -> 0.33
A63: Ricotta 33% fat/DM [REWE Marca Italia] | B63: 0 | C63: g | D63: 1 | E63: 134 | F63: 9 | G63: 3.2 | H63: 3.2 | I63: 10 | J63: 0.16 | K63: of:=[.H63]/100 -> 0.032
A64: Salt | B64: 0 | C64: g | D64: 2 | J64: 100 | K64: 5.9
A65: Scandic Bärgløgg 11 vol% [Katlenburger] | B65: 0 | C65: ml | D65: 1 | E65: 120 | K65: of:=[.H65]/100+0.11*0.789*7.4 -> 0.642246 | L65: 1 bottle = 750ml
A66: Skim Milk 1.5% [Weihenstephan] | B66: 0 | C66: ml | D66: 1 | E66: 47 | F66: 1.5 | G66: 4.9 | H66: 4.9 | I66: 3.5 | J66: 0.11 | K66: of:=[.H66]/100 -> 0.049
A67: Skim Milkpowder 1:10 [Vita2You] | B67: 0 | C67: g | D67: 2 | E67: 358 | F67: 0.97 | G67: 50.5 | H67: 50.5 | I67: 35 | J67: 1 | K67: of:=[.H67]/100 -> 0.505
A68: Soy sauce | B68: 0 | C68: ml | D68: 1 | E68: 75 | F68: 0 | G68: 7.4 | H68: 6.7 | I68: 7.2 | J68: 17.1 | K68: of:=[.H68]/100 -> 0.067
A69: Strawberries | B69: 0 | C69: g | D69: 1 | E69: 31 | F69: 0.4 | G69: 5.8 | H69: 5.7 | I69: 0.8 | J69: 0 | K69: of:=[.H69]/100 -> 0.057
A70: Strawberry slices freeze-dried [EWL] | B70: 0 | C70: g | D70: 4 | E70: 300 | F70: 3.3 | G70: 48 | H70: 48 | I70: 7 | J70: 0.01 | L70: Mix-in for a full tub (2 servings)
A71: Tara gum (E417) | B71: 0 | C71: g | D71: 2 | E71: 185 | F71: 0.31 | G71: 87 | H71: 0 | I71: 2.26 | J71: 0
A72: Tylose powder (E466 / CMC) [GoodBake] | B72: 0 | C72: g | D72: 2 | E72: 600 | G72: 75
A73: Ube Yam Root powder [Fil Choice] | B73: 0 | C73: g | D73: 2 | E73: 382 | F73: 0.6 | G73: 83 | H73: 9.5 | I73: 6.1 | J73: 0.3 | K73: of:=[.H73]/100 -> 0.095 | L73: like vanilla+pistachio
A74: Vanilla Extract (w/ alcohol) [Native Vanilla] | B74: 0 | C74: ml | D74: 1 | E74: 300 | K74: of:=7.4*0.3 -> 2.22
A75: Vodka 40 vol% (measured by volume) | B75: 0 | C75: ml | D75: 1 | E75: 225 | K75: of:=7.4*0.78945*0.4 -> 2.336772
A76: Vodka 40 vol% (measured by weigth) | B76: 0 | C76: g | D76: 1 | E76: of:=40*7 -> 280 | K76: of:=7.4*0.4 -> 2.96
A77: Water (boiling) | B77: 0 | C77: ml | D77: 0
A78: Water (cold) | B78: 0 | C78: ml | D78: 1
A79: Water to MAX line | B79: 0 | C79: ml | D79: 3
A80: Whey protein Vanilla [MaxiNutrition] | B80: 0 | C80: g | D80: 2 | E80: 392 | F80: 5.8 | G80: 6.2 | H80: 5.3 | I80: 78 | J80: 0.57 | K80: of:=[.H80]/100 -> 0.053
A81: Xanthan gum (E415, XG) | B81: 0 | C81: g | D81: 2 | E81: 320 | G81: 78 | I81: 6 | J81: 1
A82: Xylitol | B82: 0 | C82: g | D82: 2 | E82: 238 | G82: 100 | K82: 2.2 | L82: Sweetness = 100%; GI = 7
A83: Zucchini (raw, peeled) | B83: 0 | C83: g | D83: 1 | E83: 17 | F83: 0.3 | G83: 3.4 | H83: 2.1 | I83: 1.2 | J83: 0

Sheet: Ice Cream Stabilizer • ICSv2
A1: Ice Cream Stabilizer • ICSv2
B3: Amount | C3: Unit | E3: kcal | F3: Fat | G3: Carbs | H3: Sugar | I3: Protein | J3: Salt | K3: FPDF
A4: Nutritional values per 100g/ml | B4: 100 | C4: g | E4: of:=[.E6]/[.$B6]*[.$B4] -> 107.327981651376 | F4: of:=[.F6]/[.$B6]*[.$B4] -> 0.00497706422018349 | G4: of:=[.G6]/[.$B6]*[.$B4] -> 54.7362385321101 | H4: of:=[.H6]/[.$B6]*[.$B4] -> 3.6697247706422 | I4: of:=[.I6]/[.$B6]*[.$B4] -> 0.0638073394495413 | J4: of:=[.J6]/[.$B6]*[.$B4] -> 1.70183486238532 | K4: of:=[.$B$9] -> 1.32000458715596
A5: Nutritional values per dose | B5: 30 | C5: g | E5: of:=[.E6]/[.$B6]*[.$B5] -> 32.1983944954128 | F5: of:=[.F6]/[.$B6]*[.$B5] -> 0.00149311926605505 | G5: of:=[.G6]/[.$B6]*[.$B5] -> 16.420871559633 | H5: of:=[.H6]/[.$B6]*[.$B5] -> 1.10091743119266 | I5: of:=[.I6]/[.$B6]*[.$B5] -> 0.0191422018348624 | J5: of:=[.J6]/[.$B6]*[.$B5] -> 0.510550458715596 | K5: of:=[.$B$9] -> 1.32000458715596
A6: Nutritional values total | B6: of:=SUMIFS([.B21:.B964];[.C21:.C964];"=(g|ml)";[.E21:.E964];"<>4") -> 218 | C6: g | E6: of:=SUMPRODUCT([.$B21:.$B993];[.E21:.E993])/100 -> 233.975 | F6: of:=SUMPRODUCT([.$B21:.$B993];[.F21:.F993])/100 -> 0.01085 | G6: of:=SUMPRODUCT([.$B21:.$B993];[.G21:.G993])/100 -> 119.325 | H6: of:=SUMPRODUCT([.$B21:.$B993];[.H21:.H993])/100 -> 8 | I6: of:=SUMPRODUCT([.$B21:.$B993];[.I21:.I993])/100 -> 0.1391 | J6: of:=SUMPRODUCT([.$B21:.$B993];[.J21:.J993])/100 -> 3.71 | K6: of:=[.$B$9] -> 1.32000458715596
A8: FPDF | B8: of:=SUMPRODUCT([.$B21:.$B995];[.$K21:.$K995])/[.$B$6] -> 1.4204128440367
A9: FPDF (w/o salt) | B9: of:=[.B8]-0.059*[.$J$4] -> 1.32000458715596
A11: Pre-mixed stabilizer for Ninja Creami recipes.
A12: It takes handling small amounts of ingredients and their ratio to each other out of the process of mixing your final ice cream base, making the overall process less finicky.
A13: Use 30g of the mix for a Creami Deluxe tub (24oz), And 20g for the regular size (16oz).
A14: The salt is added for convenience with final recipes, and for a FPDF boost.
A15: http://bit.ly/4frc4Vj
A16: 30g Ice Cream Stabilizer (ICSv2) is | B16: 14.3g erythritol, 1.43g Tylose powder (CMC, E466), 0.5g tara gum (E417), 0.15g xanthan (E415), 14.3g inulin, 0.5g salt.
A17: 2024-10-29 | B17: ICSv2 – Added inulin
A20: Ingredients | B20: Amount | C20: Unit | D20: # | E20: kcal | F20: Fat | G20: Carbs | H20: Sugar | I20: Protein | J20: Salt | K20: FPDF | L20: Comment
A21: Erythritol (E968) | B21: 100 | C21: g | D21: 2 | E21: 0 | F21: 0 | G21: 100 | H21: 0 | I21: 0 | J21: 0 | K21: 2.8 | L21: Sweetness = 75%
A22: Tylose powder (E466, Tylo, CMC) | B22: 10 | C22: g | D22: 2 | E22: 143 | F22: 0 | G22: 75 | H22: 0 | I22: 0 | J22: 0
A23: Tara gum (E417) | B23: 3.5 | C23: g | D23: 2 | E23: 185 | F23: 0.31 | G23: 87 | H23: 0 | I23: 2.26 | J23: 0
A24: Salt | B24: 3.5 | C24: g | D24: 2 | E24: 0 | F24: 0 | G24: 0 | H24: 0 | I24: 0 | J24: 100 | K24: 5.9
A25: Xanthan gum (E415, XG) | B25: 1 | C25: g | D25: 2 | E25: 320 | F25: 0 | G25: 78 | H25: 0 | I25: 6 | J25: 1
A26: Xylitol | B26: 0 | C26: g | D26: 2 | E26: 238 | F26: 0 | G26: 100 | H26: 0 | I26: 0 | J26: 0 | K26: 2.2 | L26: Sweetness = 100%; GI = 7
A27: Inulin [Vit4ever] | B27: 100 | C27: g | D27: 2 | E27: 210 | F27: 0 | G27: 8 | H27: 8 | I27: 0 | J27: 0.2 | K27: 0.09 | L27: Sweetness = 8%; GI ~= 0